{
  "id": "550e8400-e29b-41d4-a716-446655440000",
  "created_at": "2026-10-20T09:15:00Z",
  "birthday": "1990-05-17",
  "billing_address": { "street": "Calle Mayor 12", "city": "Vinaros" },
  "shipping_address": { "street": "Avenida del Mar 3", "city": "Castellon" },
  "payments": [
    { "amount": 59.9, "paid_at": "2026-10-20T09:20:00Z" },
    { "amount": 120, "paid_at": null }
  ],
  "metadata": { "source": "app" }
}
